{
  "status": "candidate",
  "objective": {
    "households_served": 22,
    "priority_weight": 39,
    "mean_travel_minutes": 143.14,
    "vehicles_used": 7
  },
  "vehicles": [
    {
      "vehicle": "V1",
      "driver": "Driver_1",
      "assistants": [
        "O1_TrainedAssistant"
      ],
      "loading_start": "08:10",
      "departure": "08:15",
      "route": [
        {
          "request": "R1",
          "household": "H22",
          "service_start": "09:07"
        },
        {
          "request": "R2",
          "household": "H7",
          "service_start": "10:05"
        },
        {
          "request": "R3",
          "household": "H4",
          "service_start": "10:55"
        },
        {
          "request": "R4",
          "household": "H1",
          "service_start": "11:10"
        },
        {
          "request": "R5",
          "household": "H10",
          "service_start": "11:43"
        },
        {
          "request": "R6",
          "household": "H16",
          "service_start": "12:17"
        }
      ],
      "return": "13:11"
    },
    {
      "vehicle": "V2",
      "driver": "Driver_2",
      "assistants": [],
      "loading_start": "08:10",
      "departure": "08:15",
      "route": [
        {
          "request": "R7",
          "household": "H13",
          "service_start": "08:40"
        }
      ],
      "return": "09:15"
    },
    {
      "vehicle": "V3",
      "driver": "Driver_3",
      "assistants": [],
      "loading_start": "08:10",
      "departure": "08:15",
      "route": [
        {
          "request": "R8",
          "household": "H19",
          "service_start": "09:09"
        }
      ],
      "return": "10:13"
    },
    {
      "vehicle": "V4",
      "driver": "Driver_4",
      "assistants": [
        "O2_TrainedAssistant"
      ],
      "loading_start": "08:30",
      "departure": "08:35",
      "route": [
        {
          "request": "R9",
          "household": "H2",
          "service_start": "09:09"
        },
        {
          "request": "R11",
          "household": "H17",
          "service_start": "10:07"
        },
        {
          "request": "R12",
          "household": "H20",
          "service_start": "10:23"
        },
        {
          "request": "R13",
          "household": "H8",
          "service_start": "11:27"
        },
        {
          "request": "R14",
          "household": "H14",
          "service_start": "11:51"
        },
        {
          "request": "R15",
          "household": "H5",
          "service_start": "12:25"
        }
      ],
      "return": "13:05"
    },
    {
      "vehicle": "V5",
      "driver": "Driver_5",
      "assistants": [],
      "loading_start": "08:30",
      "departure": "08:35",
      "route": [
        {
          "request": "R10",
          "household": "H11",
          "service_start": "09:25"
        }
      ],
      "return": "10:01"
    },
    {
      "vehicle": "V7",
      "driver": "Driver_7",
      "assistants": [
        "O3_TrainedAssistant"
      ],
      "loading_start": "08:50",
      "departure": "08:55",
      "route": [
        {
          "request": "R16",
          "household": "H3",
          "service_start": "10:06"
        },
        {
          "request": "R17",
          "household": "H12",
          "service_start": "10:34"
        },
        {
          "request": "R18",
          "household": "H9",
          "service_start": "11:29"
        },
        {
          "request": "R19",
          "household": "H21",
          "service_start": "12:14"
        },
        {
          "request": "R20",
          "household": "H18",
          "service_start": "13:06"
        },
        {
          "request": "R21",
          "household": "H6",
          "service_start": "13:33"
        }
      ],
      "return": "14:17"
    },
    {
      "vehicle": "V8",
      "driver": "Driver_8",
      "assistants": [],
      "loading_start": "08:50",
      "departure": "08:55",
      "route": [
        {
          "request": "R22",
          "household": "H15",
          "service_start": "09:45"
        }
      ],
      "return": "10:45"
    }
  ],
  "request_status": [
    {
      "request": "R1",
      "status": "fulfilled",
      "vehicle": "V1"
    },
    {
      "request": "R2",
      "status": "fulfilled",
      "vehicle": "V1"
    },
    {
      "request": "R3",
      "status": "fulfilled",
      "vehicle": "V1"
    },
    {
      "request": "R4",
      "status": "fulfilled",
      "vehicle": "V1"
    },
    {
      "request": "R5",
      "status": "fulfilled",
      "vehicle": "V1"
    },
    {
      "request": "R6",
      "status": "fulfilled",
      "vehicle": "V1"
    },
    {
      "request": "R7",
      "status": "fulfilled",
      "vehicle": "V2"
    },
    {
      "request": "R8",
      "status": "fulfilled",
      "vehicle": "V3"
    },
    {
      "request": "R9",
      "status": "fulfilled",
      "vehicle": "V4"
    },
    {
      "request": "R10",
      "status": "fulfilled",
      "vehicle": "V5"
    },
    {
      "request": "R11",
      "status": "fulfilled",
      "vehicle": "V4"
    },
    {
      "request": "R12",
      "status": "fulfilled",
      "vehicle": "V4"
    },
    {
      "request": "R13",
      "status": "fulfilled",
      "vehicle": "V4"
    },
    {
      "request": "R14",
      "status": "fulfilled",
      "vehicle": "V4"
    },
    {
      "request": "R15",
      "status": "fulfilled",
      "vehicle": "V4"
    },
    {
      "request": "R16",
      "status": "fulfilled",
      "vehicle": "V7"
    },
    {
      "request": "R17",
      "status": "fulfilled",
      "vehicle": "V7"
    },
    {
      "request": "R18",
      "status": "fulfilled",
      "vehicle": "V7"
    },
    {
      "request": "R19",
      "status": "fulfilled",
      "vehicle": "V7"
    },
    {
      "request": "R20",
      "status": "fulfilled",
      "vehicle": "V7"
    },
    {
      "request": "R21",
      "status": "fulfilled",
      "vehicle": "V7"
    },
    {
      "request": "R22",
      "status": "fulfilled",
      "vehicle": "V8"
    },
    {
      "request": "R23",
      "status": "covered_by_alternative",
      "covered_by": "R10"
    },
    {
      "request": "R24",
      "status": "covered_by_alternative",
      "covered_by": "R13"
    },
    {
      "request": "R25",
      "status": "covered_by_alternative",
      "covered_by": "R5"
    },
    {
      "request": "R26",
      "status": "covered_by_alternative",
      "covered_by": "R4"
    }
  ],
  "unserved_households": []
}
