{
  "status": "feasible_witness",
  "objective": {
    "households_served": 7,
    "priority_weight": 13,
    "mean_travel_minutes": 113.75,
    "vehicles_used": 4
  },
  "vehicles": [
    {
      "vehicle": "V1",
      "driver": "Driver_1",
      "assistants": [],
      "loading_start": "08:15",
      "departure": "08:20",
      "route": [
        {
          "request": "R1",
          "household": "H3",
          "service_start": "08:35"
        },
        {
          "request": "R2",
          "household": "H7",
          "service_start": "09:15"
        }
      ],
      "return": "10:10"
    },
    {
      "vehicle": "V2",
      "driver": "Driver_2",
      "assistants": [],
      "loading_start": "08:15",
      "departure": "08:20",
      "route": [
        {
          "request": "R4",
          "household": "H5",
          "service_start": "09:41"
        }
      ],
      "return": "11:12"
    },
    {
      "vehicle": "V3",
      "driver": "Driver_3",
      "assistants": [],
      "loading_start": "08:35",
      "departure": "08:40",
      "route": [
        {
          "request": "R5",
          "household": "H4",
          "service_start": "09:20"
        },
        {
          "request": "R6",
          "household": "H6",
          "service_start": "09:58"
        },
        {
          "request": "R7",
          "household": "H2",
          "service_start": "10:58"
        }
      ],
      "return": "11:37"
    },
    {
      "vehicle": "V4",
      "driver": "Driver_4",
      "assistants": [],
      "loading_start": "08:35",
      "departure": "08:40",
      "route": [
        {
          "request": "R8",
          "household": "H8",
          "service_start": "09:08"
        }
      ],
      "return": "09:46"
    }
  ],
  "request_status": [
    {
      "request": "R1",
      "status": "fulfilled",
      "vehicle": "V1"
    },
    {
      "request": "R2",
      "status": "fulfilled",
      "vehicle": "V1"
    },
    {
      "request": "R3",
      "status": "unserved",
      "reason": "ambient demand exceeds every vehicle capacity in its organisation"
    },
    {
      "request": "R4",
      "status": "fulfilled",
      "vehicle": "V2"
    },
    {
      "request": "R5",
      "status": "fulfilled",
      "vehicle": "V3"
    },
    {
      "request": "R6",
      "status": "fulfilled",
      "vehicle": "V3"
    },
    {
      "request": "R7",
      "status": "fulfilled",
      "vehicle": "V3"
    },
    {
      "request": "R8",
      "status": "fulfilled",
      "vehicle": "V4"
    },
    {
      "request": "R9",
      "status": "covered_by_alternative",
      "covered_by": "R5"
    }
  ],
  "unserved_households": [
    {
      "household": "H1",
      "reason": "ambient demand exceeds every vehicle capacity in its organisation"
    }
  ]
}
